{
  "schema_version": 1,
  "skill_name": "hf-cli",
  "suite_canonical_sha256": "43bde944c5b98a4f8b6960a4257bc138f0bff6084576b61690ba1dd4b87cb9ec",
  "key_sha256": "PENDING-COORDINATOR-SEAL",
  "cases": [
    {
      "task_id": "pos-01",
      "criterion_count": 3
    },
    {
      "task_id": "pos-02",
      "criterion_count": 3
    },
    {
      "task_id": "pos-03",
      "criterion_count": 3
    },
    {
      "task_id": "pos-04",
      "criterion_count": 3
    },
    {
      "task_id": "pos-05",
      "criterion_count": 3
    },
    {
      "task_id": "pos-06",
      "criterion_count": 3
    },
    {
      "task_id": "pos-07",
      "criterion_count": 3
    },
    {
      "task_id": "pos-08",
      "criterion_count": 3
    },
    {
      "task_id": "pos-09",
      "criterion_count": 3
    },
    {
      "task_id": "pos-10",
      "criterion_count": 3
    }
  ]
}
