{
  "schema_version": 1,
  "skill_name": "google-workspace",
  "suite_canonical_sha256": "91f9c6a5d1154384e60a09f60d8140693420c2def50eca1ac17e7e1f8077dbf9",
  "key_sha256": "PENDING-COORDINATOR-SEAL",
  "cases": [
    {
      "task_id": "pos-01",
      "criterion_count": 3
    },
    {
      "task_id": "pos-02",
      "criterion_count": 3
    },
    {
      "task_id": "pos-03",
      "criterion_count": 3
    },
    {
      "task_id": "pos-04",
      "criterion_count": 3
    },
    {
      "task_id": "pos-05",
      "criterion_count": 3
    },
    {
      "task_id": "pos-06",
      "criterion_count": 3
    },
    {
      "task_id": "pos-07",
      "criterion_count": 3
    },
    {
      "task_id": "pos-08",
      "criterion_count": 3
    },
    {
      "task_id": "pos-09",
      "criterion_count": 3
    },
    {
      "task_id": "pos-10",
      "criterion_count": 3
    }
  ]
}
