{
  "schema_version": 1,
  "skill_name": "trl-training",
  "suite_canonical_sha256": "e73f748db7e453df078b1b18ea28deaeec99aeb3e76c936cd6385e13ef56d928",
  "key_sha256": "PENDING-COORDINATOR-SEAL",
  "cases": [
    {
      "task_id": "pos-01",
      "criterion_count": 3
    },
    {
      "task_id": "pos-02",
      "criterion_count": 3
    },
    {
      "task_id": "pos-03",
      "criterion_count": 3
    },
    {
      "task_id": "pos-04",
      "criterion_count": 3
    },
    {
      "task_id": "pos-05",
      "criterion_count": 3
    },
    {
      "task_id": "pos-06",
      "criterion_count": 3
    },
    {
      "task_id": "pos-07",
      "criterion_count": 3
    },
    {
      "task_id": "pos-08",
      "criterion_count": 3
    },
    {
      "task_id": "pos-09",
      "criterion_count": 3
    },
    {
      "task_id": "pos-10",
      "criterion_count": 3
    }
  ]
}
