{
  "schema_version": 1,
  "skill_name": "skillguard",
  "suite_canonical_sha256": "0680e0cbea47330d1602b6342344f3040da1f4214c5ed59d3d1291c18d92da73",
  "key_sha256": "PENDING-COORDINATOR-SEAL",
  "cases": [
    {
      "task_id": "pos-01",
      "criterion_count": 3
    },
    {
      "task_id": "pos-02",
      "criterion_count": 3
    },
    {
      "task_id": "pos-03",
      "criterion_count": 3
    },
    {
      "task_id": "pos-04",
      "criterion_count": 3
    },
    {
      "task_id": "pos-05",
      "criterion_count": 3
    },
    {
      "task_id": "pos-06",
      "criterion_count": 3
    },
    {
      "task_id": "pos-07",
      "criterion_count": 3
    },
    {
      "task_id": "pos-08",
      "criterion_count": 3
    },
    {
      "task_id": "pos-09",
      "criterion_count": 3
    },
    {
      "task_id": "pos-10",
      "criterion_count": 3
    }
  ]
}
