{
  "schema_version": 1,
  "skill_name": "sync-traycer-notion",
  "suite_canonical_sha256": "25bf5abe997a92d8038a56b2441a0414405bf017ca4c24c056db3940dce70109",
  "key_sha256": "PENDING-COORDINATOR-SEAL",
  "cases": [
    {
      "task_id": "first-turn-new-story",
      "criterion_count": 3
    },
    {
      "task_id": "move-ticket-and-complete",
      "criterion_count": 3
    },
    {
      "task_id": "board-status-pull",
      "criterion_count": 3
    },
    {
      "task_id": "duplicate-identity-stop",
      "criterion_count": 3
    },
    {
      "task_id": "first-turn-existing-epic",
      "criterion_count": 3
    },
    {
      "task_id": "new-ticket-under-story",
      "criterion_count": 3
    },
    {
      "task_id": "orphan-ticket-stop",
      "criterion_count": 3
    },
    {
      "task_id": "cycle-parent-stop",
      "criterion_count": 3
    },
    {
      "task_id": "explicit-status-push",
      "criterion_count": 3
    },
    {
      "task_id": "partial-write-retry",
      "criterion_count": 3
    }
  ]
}
